,source,author,title,description,url,urlToImage,publishedAt,content
0,"{'id': None, 'name': 'Yahoo Entertainment'}",Zacks Equity Research,Are You a Growth Investor? This 1 Stock Could Be the Perfect Pick,The Zacks Style Scores offers investors a way to easily find top-rated stocks based on their investing style. Here's why you should take advantage.,https://finance.yahoo.com/news/growth-investor-1-stock-could-134502843.html,https://media.zenfs.com/en/zacks.com/e8e4b0344809eaac6d73c9fd25fd180a,2025-07-11T13:45:02Z,"For new and old investors, taking full advantage of the stock market and investing with confidence are common goals.
Achieving those goals is made easier with the Zacks Style Scores, a unique set of… [+1677 chars]"
1,"{'id': None, 'name': 'Yahoo Entertainment'}",Yahoo Finance,Walmart ramps up e-commerce to rival Amazon's Prime Day event,"Walmart (WMT) is trying to outpace Amazon (AMZN) this year with ""Walmart Deals Week,"" a six-day savings event (two days longer than Amazon's Prime Day sales ...",https://finance.yahoo.com/video/walmart-ramps-e-commerce-rival-202751701.html,https://s.yimg.com/ny/api/res/1.2/HlPUuiFP1AuhmWht0nWZFw--/YXBwaWQ9aGlnaGxhbmRlcjt3PTEyMDA7aD02NzY-/https://s.yimg.com/os/creatr-uploaded-images/2025-07/349b1cb0-5c38-11f0-8fce-b4d5c1627e54,2025-07-08T20:27:51Z,"Amazon's Prime Day deals will take front and center stage for most shoppers this week, as it extends its signature shopping period to four days for the first time. But this year, as in recent years, … [+3841 chars]"
2,"{'id': None, 'name': 'MarketWatch'}",Quentin Fottrell,I’m saving 100% on Amazon Prime Day — and you can too,Here’s the not-so-dirty secret behind the four-day shopping lollapalooza.,https://www.marketwatch.com/story/im-saving-100-on-amazon-prime-day-and-you-can-too-3b56ef74,https://images.mktw.net/im-88436405/social,2025-07-08T09:34:00Z,"After the lavish, three-day 
multimillion-dollar wedding in Venice of Amazon AMZN founder Jeff Bezos to former TV reporter Lauren Sanchez, which drew ire and scorn from cash-strapped Americans, laun… [+344 chars]"
3,"{'id': None, 'name': 'Yahoo Entertainment'}",Josh Lipton,"Oracle soars, Amazon sinks, Home Depot's $4.3B acquisition",Market Domination co-host Josh Lipton tracks today's top moving stocks and biggest market stories in this Market Minute. Oracle (ORCL) shares are surging...,https://finance.yahoo.com/video/oracle-soars-amazon-sinks-home-182451045.html,https://s.yimg.com/ny/api/res/1.2/xoZN2tV5OSHtjLGn2XCkcA--/YXBwaWQ9aGlnaGxhbmRlcjt3PTEyMDA7aD02NzU-/https://s.yimg.com/os/creatr-uploaded-images/2025-06/06254860-55df-11f0-bfcf-45a7778ddc35,2025-06-30T18:24:51Z,"Market Domination co-host Josh Lipton tracks today's top moving stocks and biggest market stories in this Market Minute.
Oracle (ORCL) shares are surging after landing a massive $30 billion cloud co… [+1380 chars]"
4,"{'id': None, 'name': 'Forbes'}","Trefis Team, Contributor, 
 Trefis Team, Contributor
 https://www.forbes.com/sites/greatspeculations/people/trefis/",AMZN Stock To $400?,But what could propel the stock to double from current levels over the next few years?,https://www.forbes.com/sites/greatspeculations/2025/06/25/amzn-stock-to-400/,https://imageio.forbes.com/specials-images/imageserve/685b8efe38e324f97498e41c/0x0.jpg?format=jpg&height=900&width=1600&fit=bounds,2025-06-25T13:28:37Z,"CHONGQING, CHINA - APRIL 26: In this photo illustration, the logo of Amazon.com, Inc. is displayed ... More on a smartphone screen, with the company's iconic smile branding visible in the background,… [+7567 chars]"
5,"{'id': None, 'name': 'Github.com'}",osbuild,bootc-image-builder: Build your entire OS from a Containerfile,A container for deploying bootable container images. - osbuild/bootc-image-builder,https://github.com/osbuild/bootc-image-builder,https://opengraph.githubassets.com/91d80767d62375ed1d15a91d460647b6355d3d758af3718d7f9e008280f337e5/osbuild/bootc-image-builder,2025-06-24T15:01:07Z,"A container to create disk images from bootc container inputs,
especially oriented towards Fedora/CentOS bootc or
derivatives.
Have podman installed on your system. Either through your systems pac… [+19148 chars]"
6,"{'id': None, 'name': 'Barchart.com'}",Wajeeh Khan,"Dear Amazon Stock Fans, Mark Your Calendars for July 8",All eyes are on Amazon stock as the company’s Prime Day event kicks off. Bank of America sees upside in AMZN shares to $248.,https://www.barchart.com/story/news/33265033/dear-amazon-stock-fans-mark-your-calendars-for-july-8,https://s.yimg.com/ny/api/res/1.2/MbpbccWdhXNcDy2RGmCtNQ--/YXBwaWQ9aGlnaGxhbmRlcjt3PTEyMDA7aD05MDA-/https://media.zenfs.com/en/barchart_com_477/6c458cf3fdd65b21366485ca0245745a,2025-07-08T11:00:03Z,"amazon holiday delivery boxes by Cineberg via iStock
Amazon (AMZN) shares remain in focus ahead of the companys longest-ever Prime Day event, set to kick off today (July 8) and run through Friday (J… [+2052 chars]"
7,"{'id': None, 'name': 'Yahoo Entertainment'}",Ricardo Pillai,"Amazon.com, Inc. (AMZN): A Bull Case Theory","We came across a bullish thesis on Amazon.com, Inc. on Disruptive Analytics’ Substack by Magnus Ofstad. In this article, we will summarize the bulls’ thesis ...",https://finance.yahoo.com/news/amazon-com-inc-amzn-bull-164557092.html,https://media.zenfs.com/en/insidermonkey.com/29d5df0573f93ed5d198b486ad7e285b,2025-07-07T16:45:57Z,"We came across a bullish thesis on Amazon.com, Inc. on Disruptive Analytics Substack by Magnus Ofstad. In this article, we will summarize the bulls thesis on AMZN. Amazon.com, Inc.'s share was tradin… [+3099 chars]"
8,"{'id': None, 'name': 'TheStreet'}",Rob Lenihan,Microsoft analysts reboot stock price targets ahead of Q4 earnings,This is what could happen next to Microsoft shares.,https://www.thestreet.com/investing/stocks/microsoft-analysts-reboot-stock-price-targets-ahead-of-q4-earnings,https://media.zenfs.com/en/thestreet_881/ba0f95eb88d629fd80813d89cdb2b04b,2025-07-16T21:57:00Z,"Microsoft analysts reboot stock price targets ahead of Q4 earnings originally appeared on TheStreet.
Hey, good news, Microsoft  (MSFT) , you made the list.
The software giant got some high praise i… [+4971 chars]"
9,"{'id': None, 'name': 'Yahoo Entertainment'}",Ghazal Ahmed,"Cantor Fitzgerald Stays Bullish on Amazon (AMZN), Lifts Target to $260 on Retail and AWS Growth","Amazon.com, Inc. (NASDAQ:AMZN) is one of the AI Stocks Investors Are Watching Closely. On July 16, Cantor Fitzgerald analyst Deepak Mathivanan raised the...",https://finance.yahoo.com/news/cantor-fitzgerald-stays-bullish-amazon-141736890.html,https://s.yimg.com/ny/api/res/1.2/UUrmeLYv9d.rv0kB2kTHEQ--/YXBwaWQ9aGlnaGxhbmRlcjt3PTEyMDA7aD02Nzc-/https://media.zenfs.com/en/insidermonkey.com/d2404fc756dc449f1bbfb4044bddd352,2025-07-19T14:17:36Z,"Amazon.com, Inc. (NASDAQ:AMZN) is one of the AI Stocks Investors Are Watching Closely.  On July 16, Cantor Fitzgerald analyst Deepak Mathivanan raised the price target on the stock to $260.00 (from $… [+1966 chars]"
10,"{'id': None, 'name': 'Yahoo Entertainment'}",,Morningstar Believes Amazon.com (AMZN)’s Retail Business Has Wide Moat,,https://consent.yahoo.com/v2/collectConsent?sessionId=1_cc-session_129093c5-0670-4355-9eb9-d37953ef65e3,,2025-07-09T04:47:11Z,"If you click 'Accept all', we and our partners, including 236 who are part of the IAB Transparency &amp; Consent Framework, will also store and/or access information on a device (in other words, use … [+714 chars]"
11,"{'id': None, 'name': 'Yahoo Entertainment'}",Ramish Cheema,"Amazon.com, Inc. (AMZN) Is Dominating Retail, Says Jim Cramer","We recently published Jim Cramer Discussed These 10 Stocks & AI-Led Job Growth. Amazon.com, Inc. (NASDAQ:AMZN) is one of the stocks Jim Cramer recently...",https://finance.yahoo.com/news/amazon-com-inc-amzn-dominating-102853293.html,https://s.yimg.com/ny/api/res/1.2/v4vjuMw83AspvSftOzdXyQ--/YXBwaWQ9aGlnaGxhbmRlcjt3PTEyMDA7aD02NzM-/https://media.zenfs.com/en/insidermonkey.com/226ed9ed0936942adb97f3d56073e411,2025-07-18T10:28:53Z,"We recently published Jim Cramer Discussed These 10 Stocks &amp; AI-Led Job Growth. Amazon.com, Inc. (NASDAQ:AMZN) is one of the stocks Jim Cramer recently discussed.
Amazon.com, Inc. (NASDAQ:AMZN) … [+2368 chars]"
12,"{'id': None, 'name': 'Yahoo Entertainment'}",Rameen Kasana,"Bezos Sells Millions in Amazon.com, Inc. (AMZN) Under Trading Plan","Amazon.com, Inc. (NASDAQ:AMZN) is among the 11 best places to invest money without risk. According to the Securities and Exchange Commission filing on...",https://finance.yahoo.com/news/bezos-sells-millions-amazon-com-151410025.html,https://s.yimg.com/ny/api/res/1.2/v4vjuMw83AspvSftOzdXyQ--/YXBwaWQ9aGlnaGxhbmRlcjt3PTEyMDA7aD02NzM-/https://media.zenfs.com/en/insidermonkey.com/226ed9ed0936942adb97f3d56073e411,2025-07-08T15:14:10Z,"Amazon.com, Inc. (NASDAQ:AMZN) is among the 11 best places to invest money without risk. According to the Securities and Exchange Commission filing on Tuesday, Jeff Bezos, the founder and chairman of… [+1999 chars]"
13,"{'id': None, 'name': 'Yahoo Entertainment'}",Ramish Cheema,"Amazon.com, Inc. (AMZN):”The Bargains Are Incredible,” Says Jim Cramer","We recently published 14 Stocks Jim Cramer Discussed As He Talked About Record Bitcoin Price. Amazon.com, Inc. (NASDAQ:AMZN) is one of the stocks Jim Cramer ...",https://finance.yahoo.com/news/amazon-com-inc-amzn-bargains-183631080.html,https://s.yimg.com/ny/api/res/1.2/v4vjuMw83AspvSftOzdXyQ--/YXBwaWQ9aGlnaGxhbmRlcjt3PTEyMDA7aD02NzM-/https://media.zenfs.com/en/insidermonkey.com/226ed9ed0936942adb97f3d56073e411,2025-07-12T18:36:31Z,"We recently published 14 Stocks Jim Cramer Discussed As He Talked About Record Bitcoin Price. Amazon.com, Inc. (NASDAQ:AMZN) is one of the stocks Jim Cramer recently discussed.
Amazon.com, Inc. (NAS… [+1862 chars]"
14,"{'id': None, 'name': 'Barchart.com'}",Neharika Jain,Amazon.com Earnings Preview: What to Expect,"Amazon.com is expected to release its fiscal second-quarter earnings next month, and analysts project a single-digit profit growth.",https://www.barchart.com/story/news/33492061/amazon-com-earnings-preview-what-to-expect,https://s.yimg.com/ny/api/res/1.2/8VEI3wFSZn63jEBNw3FRIg--/YXBwaWQ9aGlnaGxhbmRlcjt3PTEyMDA7aD03OTk-/https://media.zenfs.com/en/barchart_com_477/311ef6620bb313fd56363079b8a1ae4e,2025-07-18T12:20:09Z,"Amazon_com Inc_ package by - AdrianHancu via iStock
Seattle, Washington-based Amazon.com, Inc. (AMZN)  is one of the worlds largest e-commerce companies, offering retail sales of consumer products, … [+2179 chars]"
15,"{'id': None, 'name': 'Yahoo Entertainment'}",Brian Sozzi,Meta vs. Nvidia: How to play Mag 7 in the second half of 2025,"The ""Magnificent Seven,"" the group of stocks comprising Nvidia (NVDA), Alphabet (GOOG, GOOGL), Tesla (TSLA), Microsoft (MSFT), Amazon (AMZN), Meta (META...",https://finance.yahoo.com/video/meta-vs-nvidia-play-mag-103024955.html,https://s.yimg.com/ny/api/res/1.2/ppmzucmDsnbNn9pV4j85dQ--/YXBwaWQ9aGlnaGxhbmRlcjt3PTEyMDA7aD02NzU-/https://s.yimg.com/os/creatr-uploaded-images/2025-07/5040aed0-5689-11f0-a3e7-a0b1902ff879,2025-07-02T10:30:24Z,"Meta just hit a record high on Monday. Nvidia's 17% surge the past month has it knocking on the door of a $4 trillion market cap. My question is this, should you own both Meta and Nvidia in the face … [+2909 chars]"
16,"{'id': None, 'name': 'Yahoo Entertainment'}",Ghazal Ahmed,"Baird Lifts Amazon (AMZN) Price Target Ahead of Earnings, Citing New Growth Bets","Amazon.com, Inc. (NASDAQ:AMZN) is one of the AI Stocks Analysts Are Tracking Closely. On July 21, Baird analyst Colin Sebastian maintained an “Outperform” on...",https://finance.yahoo.com/news/baird-lifts-amazon-amzn-price-164009398.html,https://s.yimg.com/ny/api/res/1.2/VBxYhcLhAemh5W9olSeufw--/YXBwaWQ9aGlnaGxhbmRlcjt3PTEyMDA7aD02NzM-/https://media.zenfs.com/en/insidermonkey.com/dae3f44c8d08f87d6cb24ec832583335,2025-07-22T16:40:09Z,"Amazon.com, Inc. (NASDAQ:AMZN) is one of the AI Stocks Analysts Are Tracking Closely. On July 21, Baird analyst Colin Sebastian maintained an Outperform on the stock and raised the price target from … [+1254 chars]"
17,"{'id': None, 'name': 'Yahoo Entertainment'}",Soumya Eswaran,Amazon.com (AMZN) Faces Challenges in AI Leadership,Longriver Investment Partners released its “Longriver Partners Fund” second-quarter 2025 investor letter. A copy of the letter can be downloaded here. In the...,https://finance.yahoo.com/news/amazon-com-amzn-faces-challenges-120416406.html,https://media.zenfs.com/en/insidermonkey.com/200db36b3627d8c0741a12874b6a7da4,2025-07-11T12:04:16Z,"Longriver Investment Partners released its ""Longriver Partners Fund"" second-quarter 2025 investor letter. A copy of the letter can be downloaded here. In the quarter, the fund returned 11.7% (net), b… [+2447 chars]"
18,"{'id': None, 'name': 'Yahoo Entertainment'}",,Amazon (AMZN) Unveils $54 Billion UK Investment Plan for 2025–2027,,https://consent.yahoo.com/v2/collectConsent?sessionId=1_cc-session_54d3b394-50d5-4d9f-ac41-86447b546254,,2025-06-28T09:41:11Z,"If you click 'Accept all', we and our partners, including 235 who are part of the IAB Transparency &amp; Consent Framework, will also store and/or access information on a device (in other words, use … [+714 chars]"
19,"{'id': None, 'name': 'Yahoo Entertainment'}",Ghazal Ahmed,Amazon (AMZN)’s AI Push Could Fuel AWS Growth—And Wall Street Is Finally Noticing,"Amazon.com, Inc. (NASDAQ:AMZN) is one of the Trending AI Stocks on Wall Street. On July 10, Citizens JMP analyst Andrew Boone raised the price target on the ...",https://finance.yahoo.com/news/amazon-amzn-ai-push-could-155042346.html,https://s.yimg.com/ny/api/res/1.2/LUTVAUSj3VXIyqW_OlQrsA--/YXBwaWQ9aGlnaGxhbmRlcjt3PTEyMDA7aD0xNTMz/https://media.zenfs.com/en/insidermonkey.com/1d470061c3c72d74c999cf7b01c69d51,2025-07-13T15:50:42Z,"Amazon.com, Inc. (NASDAQ:AMZN) is one of the Trending AI Stocks on Wall Street. On July 10, Citizens JMP analyst Andrew Boone raised the price target on the stock to $285.00 (from $250.00) while main… [+1501 chars]"
20,"{'id': None, 'name': 'Yahoo Entertainment'}",,TD Cowen Remains Bullish on Amazon (AMZN) With $250 Target on AI and Retail Tailwinds,,https://consent.yahoo.com/v2/collectConsent?sessionId=1_cc-session_13ed334d-1a44-4f84-8a34-fa81838d0171,,2025-07-09T21:30:13Z,"If you click 'Accept all', we and our partners, including 236 who are part of the IAB Transparency &amp; Consent Framework, will also store and/or access information on a device (in other words, use … [+714 chars]"
21,"{'id': None, 'name': 'Yahoo Entertainment'}",,"Wells Fargo Lifts PT on Amazon.com (AMZN) Stock, Maintains Equal Weight",,https://consent.yahoo.com/v2/collectConsent?sessionId=1_cc-session_afb4c0ad-90ad-40e1-abf8-8b516392ed39,,2025-07-11T03:25:58Z,"If you click 'Accept all', we and our partners, including 236 who are part of the IAB Transparency &amp; Consent Framework, will also store and/or access information on a device (in other words, use … [+714 chars]"
22,"{'id': None, 'name': 'Yahoo Entertainment'}",Ali Hassan,"Truist Financial Increases PT on Amazon.com Stock to $250, Keeps Buy Rating","Amazon.com, Inc. (NASDAQ:AMZN) is one of the 12 Best Stocks to Invest in for Good Returns. On July 2, Truist Financial increased the price target on...",https://finance.yahoo.com/news/truist-financial-increases-pt-amazon-042712682.html,https://s.yimg.com/ny/api/res/1.2/_8ZMROCRAxISSueZwANbyQ--/YXBwaWQ9aGlnaGxhbmRlcjt3PTEyMDA7aD0xNDY4/https://media.zenfs.com/en/insidermonkey.com/a3c8e22b72652404ccc786a9dc9fd38b,2025-07-13T04:27:12Z,"Amazon.com, Inc. (NASDAQ:AMZN) is one of the 12 Best Stocks to Invest in for Good Returns. On July 2, Truist Financial increased the price target on Amazon.com, Inc. (NASDAQ:AMZN) stock from $226 to … [+1643 chars]"
23,"{'id': None, 'name': 'Yahoo Entertainment'}",Ghazal Ahmed,"Jefferies Lifts Amazon (AMZN) Price Target to $265, Sees Revenue and Margin Upside","Amazon.com, Inc. (NASDAQ:AMZN) is one of the Trending AI Stocks in Focus This Week. Jefferies reiterated the stock as “Buy” and raised its price target on...",https://finance.yahoo.com/news/jefferies-lifts-amazon-amzn-price-111649725.html,https://media.zenfs.com/en/insidermonkey.com/912573c6f9ee1d138f17f4bc114d18ed,2025-07-19T11:16:49Z,"Amazon.com, Inc. (NASDAQ:AMZN) is one of the Trending AI Stocks in Focus This Week. Jefferies reiterated the stock as Buy and raised its price target on Amazon to $265 per share from $255. The firm i… [+1283 chars]"
24,"{'id': None, 'name': 'Yahoo Entertainment'}",Soumya Eswaran,"Alphyn Capital Management’s Comments on Amazon.com, Inc. (AMZN)","Alphyn Capital Management, an investment management firm, released its second-quarter 2025 investor letter. A copy of the letter can be downloaded here. The ...",https://finance.yahoo.com/news/alphyn-capital-management-comments-amazon-125651374.html,https://media.zenfs.com/en/insidermonkey.com/200db36b3627d8c0741a12874b6a7da4,2025-07-11T12:56:51Z,"Alphyn Capital Management, an investment management firm, released its second-quarter 2025 investor letter. A copy of the letter can be downloaded here. The Master Account of the fund returned 12.4% … [+2518 chars]"
25,"{'id': None, 'name': 'Yahoo Entertainment'}",Ramish Cheema,"Amazon.com, Inc. (AMZN): “Alexa’s Getting An Upgrade,” Says Jim Cramer","Amazon.com, Inc. (NASDAQ:AMZN) is one of the Jim Cramer Warns Viewers About FOMO & Discusses These 19 Stocks. Amazon.com, Inc. (NASDAQ:AMZN) is one of the...",https://finance.yahoo.com/news/amazon-com-inc-amzn-alexa-205533047.html,https://media.zenfs.com/en/insidermonkey.com/dc5a2bcb6b4c16a43cb5b4ba98feb139,2025-07-01T20:55:33Z,"Amazon.com, Inc. (NASDAQ:AMZN) is one of the Jim Cramer Warns Viewers About FOMO &amp; Discusses These 19 Stocks.
Amazon.com, Inc. (NASDAQ:AMZN) is one of the biggest eCommerce companies in America.… [+1918 chars]"
26,"{'id': None, 'name': 'Yahoo Entertainment'}",,"Amazon.com, Inc. (AMZN) To Expand Prime Delivery Services To Over 4,000 Smaller Cities, Towns, and Rural Areas",,https://consent.yahoo.com/v2/collectConsent?sessionId=1_cc-session_a73f9b5c-2a7e-4baf-9929-898b9772943d,,2025-06-30T21:05:35Z,"If you click 'Accept all', we and our partners, including 237 who are part of the IAB Transparency &amp; Consent Framework, will also store and/or access information on a device (in other words, use … [+714 chars]"
27,"{'id': None, 'name': 'Yahoo Entertainment'}",Pedro Goncalves,"Best cashback card deals of the week, 23 July","Discover the best credit cards to save money, earn rewards and travel smarter",https://uk.finance.yahoo.com/news/cashback-credit-card-deals-060311247.html,https://s.yimg.com/ny/api/res/1.2/3gdBrYuVOm51S2bWNlHmoA--/YXBwaWQ9aGlnaGxhbmRlcjt3PTEyMDA7aD04MDA-/https://s.yimg.com/os/creatr-uploaded-images/2025-03/9377fcc0-0d7e-11f0-b0bf-7003ad08bb40,2025-07-16T06:03:11Z,"Credit cards aren't just about spending. They are also powerful tools that, when used wisely, can help you save money, manage debt and even earn rewards. Whether you're looking to cut down on interes… [+7733 chars]"
28,"{'id': None, 'name': 'Forbes'}","Brett Owens, Contributor, 
 Brett Owens, Contributor
 https://www.forbes.com/sites/brettowens/",Secure Dividends Up To 12% From The $3+ Trillion ‘Human Bailout’,A nifty dividend duo—with yields of 9% and 12%—is ready for takeoff. Thanks to Uncle Sam’s spending bender coinciding with the rise of the machines.,https://www.forbes.com/sites/brettowens/2025/07/15/secure-dividends-up-to-12-from-the-3-trillion-human-bailout/,https://imageio.forbes.com/specials-images/imageserve/68728561e931798a2fef5909/0x0.jpg?format=jpg&height=900&width=1600&fit=bounds,2025-07-15T12:45:00Z,"High Yield, Low Risk Road Sign
getty
A nifty dividend duowith yields of 9% and 12%is ready for takeoff. Thanks to Uncle Sams spending bender coinciding with the rise of the machines.
Big tech stoc… [+4538 chars]"
29,"{'id': None, 'name': 'Barchart.com'}",Amit Singh,Alphabet Is Undervalued. Should You Buy GOOGL Stock Here?,"Alphabet stock is currently trading at levels significantly lower than those of other major tech giants such as MSFT, AAPL, and AMZN.",https://www.barchart.com/story/news/33026524/alphabet-is-undervalued-should-you-buy-googl-stock-here,https://s.yimg.com/ny/api/res/1.2/WNpA6WoJ2ffjeDmmmTsX8Q--/YXBwaWQ9aGlnaGxhbmRlcjt3PTEyMDA7aD04MDA-/https://media.zenfs.com/en/barchart_com_477/92ef183c42026825f0de825fd26975b4,2025-06-24T15:37:36Z,"Alphabet (Google) Image by Markus Mainka via Shutterstock
Alphabet (GOOGL), the parent company of Google, has seen its shares decline in 2025, with the stock down approximately 11.7% since the start… [+4723 chars]"
30,"{'id': None, 'name': 'Yahoo Entertainment'}",Syeda Seirut Javed,"Oppenheimer Increases PT on Amazon (AMZN) Stock, Maintains Outperform","Amazon.com, Inc. (NASDAQ:AMZN) is one of the 10 AI stocks that Jim Cramer and analysts are watching. On June 20, Oppenheimer raised its price target on AMZN ...",https://finance.yahoo.com/news/oppenheimer-increases-pt-amazon-amzn-205939189.html,https://s.yimg.com/ny/api/res/1.2/v4vjuMw83AspvSftOzdXyQ--/YXBwaWQ9aGlnaGxhbmRlcjt3PTEyMDA7aD02NzM-/https://media.zenfs.com/en/insidermonkey.com/226ed9ed0936942adb97f3d56073e411,2025-06-25T20:59:39Z,"Amazon.com, Inc. (NASDAQ:AMZN) is one of the 10 AI stocks that Jim Cramer and analysts are watching. On June 20, Oppenheimer raised its price target on AMZN shares to $250 from $215 and kept an Outpe… [+2003 chars]"
31,"{'id': None, 'name': 'Yahoo Entertainment'}",Ricardo Pillai,BlackBerry Limited (BB): A Bull Case Theory,"We came across a bullish thesis on BlackBerry Limited by Polymath Investor on Substack. In this article, we will summarize the bulls’ thesis on BB...",https://finance.yahoo.com/news/blackberry-limited-bb-bull-case-183346134.html,https://media.zenfs.com/en/insidermonkey.com/73e372ed9452b9d82196b7771aa4ecc5,2025-07-07T18:33:46Z,"We came across a bullish thesis on BlackBerry Limited by Polymath Investor on Substack. In this article, we will summarize the bulls thesis on BB. BlackBerry Limited's share was trading at $4.3200 as… [+3417 chars]"
32,"{'id': None, 'name': 'Investopedia'}",Sarina Trangle,"Amazon Scales Up Same-Day Delivery in Rural Areas, Where Walmart Has an Edge","Competition is heating up to sell groceries and staples to smaller communities in what Morgan Stanley described as a ""$1 trillion opportunity.""",https://www.investopedia.com/amazon-scales-up-same-day-delivery-in-rural-areas-where-walmart-has-an-edge-11760210,https://s.yimg.com/ny/api/res/1.2/r9nNeRpVhqzsHgKFFtfB_w--/YXBwaWQ9aGlnaGxhbmRlcjt3PTEyMDA7aD02NzU-/https://media.zenfs.com/en/investopedia_245/b232f821435c4cdd0d6468a33f8600b5,2025-06-24T19:30:38Z,"SOPA Images / Contributor / Getty Images, Justin Sullivan / Staff / Getty Images
 Walmart and Amazon are competing to win over shoppers in rural communities, which could represent a $1 trillion oppo… [+2750 chars]"
33,"{'id': None, 'name': 'Barchart.com'}","Mark R. Hake, CFA",Amazon Stock is a Bargain on Prime Day - Make a 2% Monthly Yield Shorting AMZN Puts,"Amazon's Prime Day is here, but the real bargain for investors is AMZN stock. It's still worth over 30% more based on its strong free cash flow. Moreover...",https://www.barchart.com/story/news/33276588/amazon-stock-is-a-bargain-on-prime-day-make-a-2-monthly-yield-shorting-amzn-puts,https://s.yimg.com/ny/api/res/1.2/hQfhzbpZs8ywuv4TOkQ.xw--/YXBwaWQ9aGlnaGxhbmRlcjt3PTEyMDA7aD04MDA-/https://media.zenfs.com/en/barchart_com_477/e15592a796a0b27fd0dd0079655e8a69,2025-07-08T16:48:47Z,"Amazon - Image by Tada Images via Shutterstock
Amazon.com (AMZN) Prime Day is here, but the real bargain for investors is AMZN stock. Investors can make over a 2.0% monthly yield by selling short 6%… [+5399 chars]"
34,"{'id': None, 'name': 'Yahoo Entertainment'}",Ghazal Ahmed,Amazon’s (AMZN) Ring Now Uses AI to Summarize Suspicious Activity for You,"Amazon.com, Inc. (NASDAQ:AMZN) is one of the 10 AI Stocks Making Waves on Wall Street. On June 25, Amazon-owned Ring announced that it is rolling out AI...",https://finance.yahoo.com/news/amazon-amzn-ring-now-uses-114958612.html,https://s.yimg.com/ny/api/res/1.2/.HgavW.ni3FYIdJ_0q.1ew--/YXBwaWQ9aGlnaGxhbmRlcjt3PTEyMDA7aD02NzM-/https://media.zenfs.com/en/insidermonkey.com/e43d1960c8824c6df4066bda5949b48f,2025-06-27T11:49:58Z,"Amazon.com, Inc. (NASDAQ:AMZN) is one of the 10 AI Stocks Making Waves on Wall Street. On June 25, Amazon-owned Ring announced that it is rolling out AI-generated summaries of footage captured by its… [+1698 chars]"
35,"{'id': None, 'name': 'Yahoo Entertainment'}",,Amazon (AMZN) Price Target Raised to $250 at Truist on Strong Q2 Outlook,,https://consent.yahoo.com/v2/collectConsent?sessionId=1_cc-session_668c9254-2a5b-4eea-b79c-106bf0e21569,,2025-07-02T21:49:05Z,"If you click 'Accept all', we and our partners, including 237 who are part of the IAB Transparency &amp; Consent Framework, will also store and/or access information on a device (in other words, use … [+714 chars]"
